Sheet: 2.10.
G2: cbegin:ym4 | I2: cbegin:ym3 | K2: cbegin:ym2 | M2: cbegin:ym1 | O2: begin:a0
B3: № п/п | C3: Наименование показателя | D3: Просроченная задолженность на начало [:a0.mes_name_rp] [:a0.god1] -го года , в т.ч. | E3: Просроченная задолженность свыше 3-лет. | F3: Просроченная задолженность за [:a0.god4] год, в т.ч. | G3: [ym4.title] года | H3: Просроченная задолженность за [:a0.god3] год, в т.ч. | I3: [ym3.title] года | J3: Просроченная задолженность за [:a0.god2] год, в т.ч. | K3: [ym2.title] года | L3: Просроченная задолженность за [:a0.god1] год, в т.ч. | M3: [ym1.title] года
A4: 1 | B4: =RC[-1] -> 1 | C4: Итого по Обществу | D4: [:a0.dolg] | E4: [:a0.dolg5] | F4: [:a0.dolg4] | G4: [:a0.dolg_by_ym4[ym4.pfx]] | H4: [:a0.dolg3] | I4: [:a0.dolg_by_ym3[ym3.pfx]] | J4: [:a0.dolg2] | K4: [:a0.dolg_by_ym2[ym2.pfx]] | L4: [:a0.dolg1] | M4: [:a0.dolg_by_ym1[ym1.pfx]]
A5: =R[-1]C+1 -> 2 | B5: =RC[-1] -> 2 | C5: Итого по [:a.name_dep] | D5: [:a.dolg] | E5: [:a.dolg5] | F5: [:a.dolg4] | G5: [:a.dolg_by_ym4[ym4.pfx]] | H5: [:a.dolg3] | I5: [:a.dolg_by_ym3[ym3.pfx]] | J5: [:a.dolg2] | K5: [:a.dolg_by_ym2[ym2.pfx]] | L5: [:a.dolg1] | M5: [:a.dolg_by_ym1[ym1.pfx]] | P5: a0.begin:a
A6: =R[-1]C+1 -> 3 | B6: =RC[-1] -> 3 | C6: Итого [:c.name_pr] по [:a.name_dep] | D6: [:c.dolg] | E6: [:c.dolg5] | F6: [:c.dolg4] | G6: [:c.dolg_by_ym4[ym4.pfx]] | H6: [:c.dolg3] | I6: [:c.dolg_by_ym3[ym3.pfx]] | J6: [:c.dolg2] | K6: [:c.dolg_by_ym2[ym2.pfx]] | L6: [:c.dolg1] | M6: [:c.dolg_by_ym1[ym1.pfx]] | Q6: a.begin:c
A7: =R[-1]C+1 -> 4 | B7: =RC[-1] -> 4 | C7: Итого [:c.name_pr] по [:b.name_uch] , в т.ч. | D7: [:b.dolg] | E7: [:b.dolg5] | F7: [:b.dolg4] | G7: [:b.dolg_by_ym4[ym4.pfx]] | H7: [:b.dolg3] | I7: [:b.dolg_by_ym3[ym3.pfx]] | J7: [:b.dolg2] | K7: [:b.dolg_by_ym2[ym2.pfx]] | L7: [:b.dolg1] | M7: [:b.dolg_by_ym1[ym1.pfx]] | R7: c.begin:b
A8: =R[-2]C+1 -> 4 | B8: =RC[-1] -> 4 | C8: [:c1.name_gr] | D8: [:c1.dolg] | E8: [:c1.dolg5] | F8: [:c1.dolg4] | G8: [:c1.dolg_by_ym4[ym4.pfx]] | H8: [:c1.dolg3] | I8: [:c1.dolg_by_ym3[ym3.pfx]] | J8: [:c1.dolg2] | K8: [:c1.dolg_by_ym2[ym2.pfx]] | L8: [:c1.dolg1] | M8: [:c1.dolg_by_ym1[ym1.pfx]] | S8: b.begin:c1
A9: =R[-2]C+1 -> 5 | B9: =RC[-1] -> 5 | C9: [:all_dog.payer_name] | D9: [:all_dog.dolg] | E9: [:all_dog.dolg5] | F9: [:all_dog.dolg4] | G9: [:all_dog.dolg_by_ym4[ym4.pfx]] | H9: [:all_dog.dolg3] | I9: [:all_dog.dolg_by_ym3[ym3.pfx]] | J9: [:all_dog.dolg2] | K9: [:all_dog.dolg_by_ym2[ym2.pfx]] | L9: [:all_dog.dolg1] | M9: [:all_dog.dolg_by_ym1[ym1.pfx]] | P9: end:a; | Q9: end:c; | R9: end:b; | S9: end:c1; | T9: c1.begin:all_dog end:all_dog;
O14: end:a0;
G15: cend:ym4; | I15: cend:ym3; | K15: cend:ym2; | M15: cend:ym1;
B16: 1