Sheet: {go_grp}
CG1: begin:a.itog
N2: План-факторный анализ за [:b.year] год [:b.kv] | CH2: a.itog.begin:b
A3: филиал [:b.name_direct]
A5: Субъект | B5: Филиал | C5: Код титула | D5: Наименование титула | E5: Год начала строительства | F5: Год окончания строительства | G5: ОСВОЕНИЕ, без НДС | U5: ФИНАНСИРОВАНИЕ, с НДС | AI5: ВВОД В ОФ, без НДС | AW5: Ввод физических параметров | BU5: Прирост мощности | CG5: headmarker
G6: план | H6: лимит | I6: факт | J6: % отклонения от плана | K6: % отклонения от лимита | L6: сумма отклонения от плана | M6: сумма отклонения от лимита | N6: Критерий | O6: Причины | P6: План на [:b.mes_name] | Q6: ожидаемый факт на [:b.mes_name] | R6: % отклонения от плана | S6: сумма отклонения от плана | T6: Причины по ож. факту | U6: план | V6: лимит | W6: факт | X6: % отклонения от плана | Y6: % отклонения от лимита | Z6: сумма отклонения от плана | AA6: сумма отклонения от лимита | AB6: Критерий | AC6: Причины | AD6: План на [:b.mes_name] | AE6: ожидаемый факт на [:b.mes_name] | AF6: % отклонения от плана | AG6: сумма отклонения от плана | AH6: Причины по ож. факту | AI6: план | AJ6: лимит | AK6: факт | AL6: % отклонения от плана | AM6: % отклонения от лимита | AN6: сумма отклонения от плана | AO6: сумма отклонения от лимита | AP6: Критерий | AQ6: Причины | AR6: План на [:b.mes_name] | AS6: ожидаемый факт на [:b.mes_name] | AT6: % отклонения от плана | AU6: сумма отклонения от плана | AV6: Причины по ож. факту | AW6: МВА | BG6: км | BQ6: другие ед. изм. | BU6: ПЛАН Прироста мощности | BX6: ФАКТ Прироста мощности | CA6: ПЛАН Прироста мощности на [:b.mes_name] | CD6: ОЖИДАЕМЫЙ ФАКТ Прироста мощности на [:b.mes_name] | CG6: headmarker
AW7: план | AX7: факт | AY7: % отклонения | AZ7: сумма отклонения | BA7: Причины | BB7: План на [:b.mes_name] | BC7: ожидаемый факт на [:b.mes_name] | BD7: % отклонения от плана | BE7: сумма отклонения от плана | BF7: Причины по ож. факту | BG7: план | BH7: факт | BI7: % отклонения | BJ7: сумма отклонения | BK7: Причины | BL7: План на [:b.mes_name] | BM7: ожидаемый факт на [:b.mes_name] | BN7: % отклонения от плана | BO7: сумма отклонения от плана | BP7: Причины по ож. факту | BQ7: план | BR7: факт | BS7: План на [:b.mes_name] | BT7: ожидаемый факт на [:b.mes_name] | BU7: МВА | BV7: км | BW7: другие ед. изм. | BX7: МВА | BY7: км | BZ7: другие ед. изм. | CA7: МВА | CB7: км | CC7: другие ед. изм. | CD7: МВА | CE7: км | CF7: другие ед. изм. | CG7: headmarker | CH7: end:b;
A8: 1 | B8: 2 | C8: 3 | D8: 4 | E8: 5 | F8: 6 | G8: =RC[-1]+1 -> 7 | H8: =RC[-1]+1 -> 8 | I8: =RC[-1]+1 -> 9 | J8: =RC[-1]+1 -> 10 | K8: =RC[-1]+1 -> 11 | L8: =RC[-1]+1 -> 12 | M8: =RC[-1]+1 -> 13 | N8: =RC[-1]+1 -> 14 | O8: =RC[-1]+1 -> 15 | P8: =RC[-1]+1 -> 16 | Q8: =RC[-1]+1 -> 17 | R8: =RC[-1]+1 -> 18 | S8: =RC[-1]+1 -> 19 | T8: =RC[-1]+1 -> 20 | U8: =RC[-1]+1 -> 21 | V8: =RC[-1]+1 -> 22 | W8: =RC[-1]+1 -> 23 | X8: =RC[-1]+1 -> 24 | Y8: =RC[-1]+1 -> 25 | Z8: =RC[-1]+1 -> 26 | AA8: =RC[-1]+1 -> 27 | AB8: =RC[-1]+1 -> 28 | AC8: =RC[-1]+1 -> 29 | AD8: =RC[-1]+1 -> 30 | AE8: =RC[-1]+1 -> 31 | AF8: =RC[-1]+1 -> 32 | AG8: =RC[-1]+1 -> 33 | AH8: =RC[-1]+1 -> 34 | AI8: =RC[-1]+1 -> 35 | AJ8: =RC[-1]+1 -> 36 | AK8: =RC[-1]+1 -> 37 | AL8: =RC[-1]+1 -> 38 | AM8: =RC[-1]+1 -> 39 | AN8: =RC[-1]+1 -> 40 | AO8: =RC[-1]+1 -> 41 | AP8: =RC[-1]+1 -> 42 | AQ8: =RC[-1]+1 -> 43 | AR8: =RC[-1]+1 -> 44 | AS8: =RC[-1]+1 -> 45 | AT8: =RC[-1]+1 -> 46 | AU8: =RC[-1]+1 -> 47 | AV8: =RC[-1]+1 -> 48 | AW8: =RC[-1]+1 -> 49 | AX8: =RC[-1]+1 -> 50 | AY8: =RC[-1]+1 -> 51 | AZ8: =RC[-1]+1 -> 52 | BA8: =RC[-1]+1 -> 53 | BB8: =RC[-1]+1 -> 54 | BC8: =RC[-1]+1 -> 55 | BD8: =RC[-1]+1 -> 56 | BE8: =RC[-1]+1 -> 57 | BF8: =RC[-1]+1 -> 58 | BG8: =RC[-1]+1 -> 59 | BH8: =RC[-1]+1 -> 60 | BI8: =RC[-1]+1 -> 61 | BJ8: =RC[-1]+1 -> 62 | BK8: =RC[-1]+1 -> 63 | BL8: =RC[-1]+1 -> 64 | BM8: =RC[-1]+1 -> 65 | BN8: =RC[-1]+1 -> 66 | BO8: =RC[-1]+1 -> 67 | BP8: =RC[-1]+1 -> 68 | BQ8: =RC[-1]+1 -> 69 | BR8: =RC[-1]+1 -> 70 | BS8: =RC[-1]+1 -> 71 | BT8: =RC[-1]+1 -> 72 | BU8: =RC[-1]+1 -> 73 | BV8: =RC[-1]+1 -> 74 | BW8: =RC[-1]+1 -> 75 | BX8: =RC[-1]+1 -> 76 | BY8: =RC[-1]+1 -> 77 | BZ8: =RC[-1]+1 -> 78 | CA8: =RC[-1]+1 -> 79 | CB8: =RC[-1]+1 -> 80 | CC8: =RC[-1]+1 -> 81 | CD8: =RC[-1]+1 -> 82 | CE8: =RC[-1]+1 -> 83 | CF8: =RC[-1]+1 -> 84
A9: [:a.sborinfo.subject_abbr] | B9: [:a.sborinfo.podr_abbr_sbor] | C9: [:a.sborinfo.tit_num_new_sbor] | D9: [:a.sborinfo.full_name_sbor] | E9: [:a.sborinfo.beg_year_sbor] | F9: [:a.sborinfo.end_year_sbor] | G9: [:a.sborinfo.kap_sum] | H9: [:a.sborinfo.kap_lim_sum] | I9: [:a.sborinfo.kap_sum_fact] | J9: [:a.sborinfo.otkl_kap_pl_perc] | K9: [:a.sborinfo.otkl_kap_lim_perc] | L9: [:a.sborinfo.otkl_kap_pl] | M9: [:a.sborinfo.otkl_kap_lim] | N9: [:a.sborinfo.fa_kvl_krit_name_a_sbor] | O9: [:a.sborinfo.pfa_kvl_prim_sbor] | P9: [:a.sborinfo.kap_sum_mes] | Q9: [:a.sborinfo.kap_sum_wait] | R9: [:a.sborinfo.otkl_kap_mes_perc] | S9: [:a.sborinfo.otkl_kap_mes] | T9: [:a.sborinfo.pfa_kvl_wprim_sbor] | U9: [:a.sborinfo.fp_sum_nds] | V9: [:a.sborinfo.fp_lim_sum_nds] | W9: [:a.sborinfo.fp_sum_nds_fact] | X9: [:a.sborinfo.otkl_fp_pl_perc] | Y9: [:a.sborinfo.otkl_fp_lim_perc] | Z9: [:a.sborinfo.otkl_fp_pl] | AA9: [:a.sborinfo.otkl_fp_lim] | AB9: [:a.sborinfo.fa_fin_krit_name_a_sbor] | AC9: [:a.sborinfo.pfa_fin_prim_sbor] | AD9: [:a.sborinfo.fp_sum_nds_mes] | AE9: [:a.sborinfo.fp_sum_nds_wait] | AF9: [:a.sborinfo.otkl_fp_mes_perc] | AG9: [:a.sborinfo.otkl_fp_mes] | AH9: [:a.sborinfo.pfa_fin_wprim_sbor] | AI9: [:a.sborinfo.vvod_sum] | AJ9: [:a.sborinfo.vvod_lim_sum] | AK9: [:a.sborinfo.vvod_sum_fact] | AL9: [:a.sborinfo.otkl_vvod_pl_perc] | AM9: [:a.sborinfo.otkl_vvod_lim_perc] | AN9: [:a.sborinfo.otkl_vvod_pl] | AO9: [:a.sborinfo.otkl_vvod_lim] | AP9: [:a.sborinfo.fa_vv_krit_name_a_sbor] | AQ9: [:a.sborinfo.pfa_vv_prim_sbor] | AR9: [:a.sborinfo.vvod_sum_mes] | AS9: [:a.sborinfo.vvod_sum_wait] | AT9: [:a.sborinfo.otkl_vvod_mes_perc] | AU9: [:a.sborinfo.otkl_vvod_mes] | AV9: [:a.sborinfo.pfa_vv_wprim_sbor] | AW9: [:a.sborinfo.pow_mba] | AX9: [:a.sborinfo.pow_mba_fact] | AY9: [:a.sborinfo.otkl_pow_mba_perc] | AZ9: [:a.sborinfo.otkl_pow_mba] | BA9: [:a.sborinfo.pfa_mba_prim_sbor] | BB9: [:a.sborinfo.pow_mba_mes] | BC9: [:a.sborinfo.pow_mba_wait] | BD9: [:a.sborinfo.otkl_pow_mba_mes_perc] | BE9: [:a.sborinfo.otkl_pow_mba_mes] | BF9: [:a.sborinfo.pfa_mba_wprim_sbor] | BG9: [:a.sborinfo.pow_km_all] | BH9: [:a.sborinfo.pow_km_all_fact] | BI9: [:a.sborinfo.otkl_pow_km_all_perc] | BJ9: [:a.sborinfo.otkl_pow_km_all] | BK9: [:a.sborinfo.pfa_km_prim_sbor] | BL9: [:a.sborinfo.pow_km_all_mes] | BM9: [:a.sborinfo.pow_km_all_wait] | BN9: [:a.sborinfo.otkl_pow_km_all_mes_perc] | BO9: [:a.sborinfo.otkl_pow_km_all_mes] | BP9: [:a.sborinfo.pfa_km_wprim_sbor] | BQ9: [:a.sborinfo.pow_other] | BR9: [:a.sborinfo.pow_other_fact] | BS9: [:a.sborinfo.pow_other_mes] | BT9: [:a.sborinfo.pow_other_wait] | BU9: [:a.sborinfo.pow_mba_pr] | BV9: [:a.sborinfo.pow_km_all_pr] | BW9: [:a.sborinfo.pow_other_pr] | BX9: [:a.sborinfo.pow_mba_fact_pr] | BY9: [:a.sborinfo.pow_km_all_fact_pr] | BZ9: [:a.sborinfo.pow_other_fact_pr] | CA9: [:a.sborinfo.pow_mba_pr_mes] | CB9: [:a.sborinfo.pow_km_all_pr_mes] | CC9: [:a.sborinfo.pow_other_pr_mes] | CD9: [:a.sborinfo.pow_mba_wait_pr] | CE9: [:a.sborinfo.pow_km_all_wait_pr] | CF9: [:a.sborinfo.pow_other_wait_pr] | CH9: a.itog.begin:a.sbor | CI9: a.sbor.begin:a.sborinfo end:a.sborinfo;
A10: [:a.single.subject_abbr] | B10: [:a.single.podr_abbr_main] | C10: [:a.single.tit_num_new_main] | D10: [:a.single.full_name_main] | E10: [:a.single.beg_year_main] | F10: [:a.single.end_year_main] | G10: [:a.single.kap_sum] | H10: [:a.single.kap_lim_sum] | I10: [:a.single.kap_sum_fact] | J10: [:a.single.otkl_kap_pl_perc] | K10: [:a.single.otkl_kap_lim_perc] | L10: [:a.single.otkl_kap_pl] | M10: [:a.single.otkl_kap_lim] | N10: [:a.single.fa_kvl_krit_name_a] | O10: [:a.single.pfa_kvl_prim] | P10: [:a.single.kap_sum_mes] | Q10: [:a.single.kap_sum_wait] | R10: [:a.single.otkl_kap_mes_perc] | S10: [:a.single.otkl_kap_mes] | T10: [:a.single.pfa_kvl_wprim] | U10: [:a.single.fp_sum_nds] | V10: [:a.single.fp_lim_sum_nds] | W10: [:a.single.fp_sum_nds_fact] | X10: [:a.single.otkl_fp_pl_perc] | Y10: [:a.single.otkl_fp_lim_perc] | Z10: [:a.single.otkl_fp_pl] | AA10: [:a.single.otkl_fp_lim] | AB10: [:a.single.fa_fin_krit_name_a] | AC10: [:a.single.pfa_fin_prim] | AD10: [:a.single.fp_sum_nds_mes] | AE10: [:a.single.fp_sum_nds_wait] | AF10: [:a.single.otkl_fp_mes_perc] | AG10: [:a.single.otkl_fp_mes] | AH10: [:a.single.pfa_fin_wprim] | AI10: [:a.single.vvod_sum] | AJ10: [:a.single.vvod_lim_sum] | AK10: [:a.single.vvod_sum_fact] | AL10: [:a.single.otkl_vvod_pl_perc] | AM10: [:a.single.otkl_vvod_lim_perc] | AN10: [:a.single.otkl_vvod_pl] | AO10: [:a.single.otkl_vvod_lim] | AP10: [:a.single.fa_vv_krit_name_a] | AQ10: [:a.single.pfa_vv_prim] | AR10: [:a.single.vvod_sum_mes] | AS10: [:a.single.vvod_sum_wait] | AT10: [:a.single.otkl_vvod_mes_perc] | AU10: [:a.single.otkl_vvod_mes] | AV10: [:a.single.pfa_vv_wprim] | AW10: [:a.single.pow_mba] | AX10: [:a.single.pow_mba_fact] | AY10: [:a.single.otkl_pow_mba_perc] | AZ10: [:a.single.otkl_pow_mba] | BA10: [:a.single.pfa_mba_prim] | BB10: [:a.single.pow_mba_mes] | BC10: [:a.single.pow_mba_wait] | BD10: [:a.single.otkl_pow_mba_mes_perc] | BE10: [:a.single.otkl_pow_mba_mes] | BF10: [:a.single.pfa_mba_wprim] | BG10: [:a.single.pow_km_all] | BH10: [:a.single.pow_km_all_fact] | BI10: [:a.single.otkl_pow_km_all_perc] | BJ10: [:a.single.otkl_pow_km_all] | BK10: [:a.single.pfa_km_prim] | BL10: [:a.single.pow_km_all_mes] | BM10: [:a.single.pow_km_all_wait] | BN10: [:a.single.otkl_pow_km_all_mes_perc] | BO10: [:a.single.otkl_pow_km_all_mes] | BP10: [:a.single.pfa_km_wprim] | BQ10: [:a.single.pow_other] | BR10: [:a.single.pow_other_fact] | BS10: [:a.single.pow_other_mes] | BT10: [:a.single.pow_other_wait] | BU10: [:a.single.pow_mba_pr] | BV10: [:a.single.pow_km_all_pr] | BW10: [:a.single.pow_other_pr] | BX10: [:a.single.pow_mba_fact_pr] | BY10: [:a.single.pow_km_all_fact_pr] | BZ10: [:a.single.pow_other_fact_pr] | CA10: [:a.single.pow_mba_pr_mes] | CB10: [:a.single.pow_km_all_pr_mes] | CC10: [:a.single.pow_other_pr_mes] | CD10: [:a.single.pow_mba_wait_pr] | CE10: [:a.single.pow_km_all_wait_pr] | CF10: [:a.single.pow_other_wait_pr] | CI10: a.sbor.begin:a.main | CJ10: a.main.begin:a.single end:a.single;
A11: [:a.head.subject_abbr] | B11: [:a.head.podr_abbr_main] | C11: [:a.head.tit_num_new_main] | D11: [:a.head.full_name_main] | E11: [:a.head.beg_year_main] | F11: [:a.head.end_year_main] | G11: [:a.head.kap_sum] | H11: [:a.head.kap_lim_sum] | I11: [:a.head.kap_sum_fact] | J11: [:a.head.otkl_kap_pl_perc] | K11: [:a.head.otkl_kap_lim_perc] | L11: [:a.head.otkl_kap_pl] | M11: [:a.head.otkl_kap_lim] | N11: [:a.head1.fa_kvl_krit_name_a] | O11: [:a.head1.pfa_kvl_prim] | P11: [:a.head.kap_sum_mes] | Q11: [:a.head.kap_sum_wait] | R11: [:a.head.otkl_kap_mes_perc] | S11: [:a.head.otkl_kap_mes] | T11: [:a.head1.pfa_kvl_wprim] | U11: [:a.head.fp_sum_nds] | V11: [:a.head.fp_lim_sum_nds] | W11: [:a.head.fp_sum_nds_fact] | X11: [:a.head.otkl_fp_pl_perc] | Y11: [:a.head.otkl_fp_lim_perc] | Z11: [:a.head.otkl_fp_pl] | AA11: [:a.head.otkl_fp_lim] | AB11: [:a.head1.fa_fin_krit_name_a] | AC11: [:a.head1.pfa_fin_prim] | AD11: [:a.head.fp_sum_nds_mes] | AE11: [:a.head.fp_sum_nds_wait] | AF11: [:a.head.otkl_fp_mes_perc] | AG11: [:a.head.otkl_fp_mes] | AH11: [:a.head1.pfa_fin_wprim] | AI11: [:a.head.vvod_sum] | AJ11: [:a.head.vvod_lim_sum] | AK11: [:a.head.vvod_sum_fact] | AL11: [:a.head.otkl_vvod_pl_perc] | AM11: [:a.head.otkl_vvod_lim_perc] | AN11: [:a.head.otkl_vvod_pl] | AO11: [:a.head.otkl_vvod_lim] | AP11: [:a.head1.fa_vv_krit_name_a] | AQ11: [:a.head1.pfa_vv_prim] | AR11: [:a.head.vvod_sum_mes] | AS11: [:a.head.vvod_sum_wait] | AT11: [:a.head.otkl_vvod_mes_perc] | AU11: [:a.head.otkl_vvod_mes] | AV11: [:a.head1.pfa_vv_wprim] | AW11: [:a.head.pow_mba] | AX11: [:a.head.pow_mba_fact] | AY11: [:a.head.otkl_pow_mba_perc] | AZ11: [:a.head.otkl_pow_mba] | BA11: [:a.head1.pfa_mba_prim] | BB11: [:a.head.pow_mba_mes] | BC11: [:a.head.pow_mba_wait] | BD11: [:a.head.otkl_pow_mba_mes_perc] | BE11: [:a.head.otkl_pow_mba_mes] | BF11: [:a.head1.pfa_mba_wprim] | BG11: [:a.head.pow_km_all] | BH11: [:a.head.pow_km_all_fact] | BI11: [:a.head.otkl_pow_km_all_perc] | BJ11: [:a.head.otkl_pow_km_all] | BK11: [:a.head1.pfa_km_prim] | BL11: [:a.head.pow_km_all_mes] | BM11: [:a.head.pow_km_all_wait] | BN11: [:a.head.otkl_pow_km_all_mes_perc] | BO11: [:a.head.otkl_pow_km_all_mes] | BP11: [:a.head1.pfa_km_wprim] | BQ11: [:a.head.pow_other] | BR11: [:a.head.pow_other_fact] | BS11: [:a.head.pow_other_mes] | BT11: [:a.head.pow_other_wait] | BU11: [:a.head.pow_mba_pr] | BV11: [:a.head.pow_km_all_pr] | BW11: [:a.head.pow_other_pr] | BX11: [:a.head.pow_mba_fact_pr] | BY11: [:a.head.pow_km_all_fact_pr] | BZ11: [:a.head.pow_other_fact_pr] | CA11: [:a.head.pow_mba_pr_mes] | CB11: [:a.head.pow_km_all_pr_mes] | CC11: [:a.head.pow_other_pr_mes] | CD11: [:a.head.pow_mba_wait_pr] | CE11: [:a.head.pow_km_all_wait_pr] | CF11: [:a.head.pow_other_wait_pr] | CJ11: a.main.begin:a.head end:a.head; | CL11: a.head.begin:a.head1 end:a.head1;
A12: [:a.child.subject_abbr] | B12: [:a.child.podr_abbr] | C12: [:a.child.tit_num_new] | D12: [:a.child.full_name] | E12: [:a.child.beg_year] | F12: [:a.child.end_year] | G12: [:a.child.kap_sum] | H12: [:a.child.kap_lim_sum] | I12: [:a.child.kap_sum_fact] | J12: [:a.child.otkl_kap_pl_perc] | K12: [:a.child.otkl_kap_lim_perc] | L12: [:a.child.otkl_kap_pl] | M12: [:a.child.otkl_kap_lim] | N12: [:a.child.fa_kvl_krit_name_a] | O12: [:a.child.pfa_kvl_prim] | P12: [:a.child.kap_sum_mes] | Q12: [:a.child.kap_sum_wait] | R12: [:a.child.otkl_kap_mes_perc] | S12: [:a.child.otkl_kap_mes] | T12: [:a.child.pfa_kvl_wprim] | U12: [:a.child.fp_sum_nds] | V12: [:a.child.fp_lim_sum_nds] | W12: [:a.child.fp_sum_nds_fact] | X12: [:a.child.otkl_fp_pl_perc] | Y12: [:a.child.otkl_fp_lim_perc] | Z12: [:a.child.otkl_fp_pl] | AA12: [:a.child.otkl_fp_lim] | AB12: [:a.child.fa_fin_krit_name_a] | AC12: [:a.child.pfa_fin_prim] | AD12: [:a.child.fp_sum_nds_mes] | AE12: [:a.child.fp_sum_nds_wait] | AF12: [:a.child.otkl_fp_mes_perc] | AG12: [:a.child.otkl_fp_mes] | AH12: [:a.child.pfa_fin_wprim] | AI12: [:a.child.vvod_sum] | AJ12: [:a.child.vvod_lim_sum] | AK12: [:a.child.vvod_sum_fact] | AL12: [:a.child.otkl_vvod_pl_perc] | AM12: [:a.child.otkl_vvod_lim_perc] | AN12: [:a.child.otkl_vvod_pl] | AO12: [:a.child.otkl_vvod_lim] | AP12: [:a.child.fa_vv_krit_name_a] | AQ12: [:a.child.pfa_vv_prim] | AR12: [:a.child.vvod_sum_mes] | AS12: [:a.child.vvod_sum_wait] | AT12: [:a.child.otkl_vvod_mes_perc] | AU12: [:a.child.otkl_vvod_mes] | AV12: [:a.child.pfa_vv_wprim] | AW12: [:a.child.pow_mba] | AX12: [:a.child.pow_mba_fact] | AY12: [:a.child.otkl_pow_mba_perc] | AZ12: [:a.child.otkl_pow_mba] | BA12: [:a.child.pfa_mba_prim] | BB12: [:a.child.pow_mba_mes] | BC12: [:a.child.pow_mba_wait] | BD12: [:a.child.otkl_pow_mba_mes_perc] | BE12: [:a.child.otkl_pow_mba_mes] | BF12: [:a.child.pfa_mba_wprim] | BG12: [:a.child.pow_km_all] | BH12: [:a.child.pow_km_all_fact] | BI12: [:a.child.otkl_pow_km_all_perc] | BJ12: [:a.child.otkl_pow_km_all] | BK12: [:a.child.pfa_km_prim] | BL12: [:a.child.pow_km_all_mes] | BM12: [:a.child.pow_km_all_wait] | BN12: [:a.child.otkl_pow_km_all_mes_perc] | BO12: [:a.child.otkl_pow_km_all_mes] | BP12: [:a.child.pfa_km_wprim] | BQ12: [:a.child.pow_other] | BR12: [:a.child.pow_other_fact] | BS12: [:a.child.pow_other_mes] | BT12: [:a.child.pow_other_wait] | BU12: [:a.child.pow_mba_pr] | BV12: [:a.child.pow_km_all_pr] | BW12: [:a.child.pow_other_pr] | BX12: [:a.child.pow_mba_fact_pr] | BY12: [:a.child.pow_km_all_fact_pr] | BZ12: [:a.child.pow_other_fact_pr] | CA12: [:a.child.pow_mba_pr_mes] | CB12: [:a.child.pow_km_all_pr_mes] | CC12: [:a.child.pow_other_pr_mes] | CD12: [:a.child.pow_mba_wait_pr] | CE12: [:a.child.pow_km_all_wait_pr] | CF12: [:a.child.pow_other_wait_pr] | CH12: end:a.sbor; | CI12: end:a.main; | CJ12: a.main.begin:a.child end:a.child;
D13: Итого | G13: [:a.itog.kap_sum] | H13: [:a.itog.kap_lim_sum] | I13: [:a.itog.kap_sum_fact] | J13: [:a.itog.otkl_kap_pl_perc] | K13: [:a.itog.otkl_kap_lim_perc] | L13: [:a.itog.otkl_kap_pl] | M13: [:a.itog.otkl_kap_lim] | P13: [:a.itog.kap_sum_mes] | Q13: [:a.itog.kap_sum_wait] | R13: [:a.itog.otkl_kap_mes_perc] | S13: [:a.itog.otkl_kap_mes] | U13: [:a.itog.fp_sum_nds] | V13: [:a.itog.fp_lim_sum_nds] | W13: [:a.itog.fp_sum_nds_fact] | X13: [:a.itog.otkl_fp_pl_perc] | Y13: [:a.itog.otkl_fp_lim_perc] | Z13: [:a.itog.otkl_fp_pl] | AA13: [:a.itog.otkl_fp_lim] | AD13: [:a.itog.fp_sum_nds_mes] | AE13: [:a.itog.fp_sum_nds_wait] | AF13: [:a.itog.otkl_fp_mes_perc] | AG13: [:a.itog.otkl_fp_mes] | AI13: [:a.itog.vvod_sum] | AJ13: [:a.itog.vvod_lim_sum] | AK13: [:a.itog.vvod_sum_fact] | AL13: [:a.itog.otkl_vvod_pl_perc] | AM13: [:a.itog.otkl_vvod_lim_perc] | AN13: [:a.itog.otkl_vvod_pl] | AO13: [:a.itog.otkl_vvod_lim] | AR13: [:a.itog.vvod_sum_mes] | AS13: [:a.itog.vvod_sum_wait] | AT13: [:a.itog.otkl_vvod_mes_perc] | AU13: [:a.itog.otkl_vvod_mes] | AW13: [:a.itog.pow_mba] | AX13: [:a.itog.pow_mba_fact] | AY13: [:a.itog.otkl_pow_mba_perc] | AZ13: [:a.itog.otkl_pow_mba] | BB13: [:a.itog.pow_mba_mes] | BC13: [:a.itog.pow_mba_wait] | BD13: [:a.itog.otkl_pow_mba_mes_perc] | BE13: [:a.itog.otkl_pow_mba_mes] | BG13: [:a.itog.pow_km_all] | BH13: [:a.itog.pow_km_all_fact] | BI13: [:a.itog.otkl_pow_km_all_perc] | BJ13: [:a.itog.otkl_pow_km_all] | BL13: [:a.itog.pow_km_all_mes] | BM13: [:a.itog.pow_km_all_wait] | BN13: [:a.itog.otkl_pow_km_all_mes_perc] | BO13: [:a.itog.otkl_pow_km_all_mes] | BQ13: [:a.itog.pow_other] | BR13: [:a.itog.pow_other_fact] | BS13: [:a.itog.pow_other_mes] | BT13: [:a.itog.pow_other_wait] | BU13: [:a.itog.pow_mba_pr] | BV13: [:a.itog.pow_km_all_pr] | BW13: [:a.itog.pow_other_pr] | BX13: [:a.itog.pow_mba_fact_pr] | BY13: [:a.itog.pow_km_all_fact_pr] | BZ13: [:a.itog.pow_other_fact_pr] | CA13: [:a.itog.pow_mba_pr_mes] | CB13: [:a.itog.pow_km_all_pr_mes] | CC13: [:a.itog.pow_other_pr_mes] | CD13: [:a.itog.pow_mba_wait_pr] | CE13: [:a.itog.pow_km_all_wait_pr] | CF13: [:a.itog.pow_other_wait_pr]
CG15: end:a.itog;