Sheet: Сметная стоимость
F1: Параметры отчета
F2: [:p.title] | G2: [:p.text] | H2: begin:p end:p;
C4: № п/п | D4: Наименование подразделения | E4: Код инвестпроекта | F4: Наименование | G4: Год начала строительства | H4: Год окончания строительства | I4: МВА | J4: км | K4: Фиксированная стоимость ИПР | U4: Текущая стоимость ИПР | AE4: Сумма по договорам | AF4: Остаток от сметной стоимости | AG4: Комментарии | AH4: headmarker
K5: Сумма УРС | L5: Сумма УРС -10% | N5: Сумма УРС -30% | O5: ПСД в ценах утвержденных (по приказу) | P5: ПСД в тек. ценах соответствующих лет | Q5: ПСД в тек. ценах -10% | S5: ПСД в тек. ценах -30% | U5: Сумма УРС | V5: Сумма УРС -10% | X5: Сумма УРС -30% | Y5: ПСД в ценах утвержденных (по приказу) | Z5: ПСД в тек. ценах соответствующих лет | AA5: ПСД в тек. ценах -10% | AC5: ПСД в тек. ценах -30% | AH5: headmarker
K6: Полная стоимость строительства | L6: Полная стоимость строительства (с учетом применения методики снижения ст-ти (-10%)) | M6: Плановая стоимость объекта в прогнозных ценах года окончания строительства | N6: Плановая стоимость объекта с учётом снижения инвестиционных затрат (методика -30%) | O6: Утвержденная сметная стоимость строительства объектов | P6: Полная стоимость строительства | Q6: Полная стоимость строительства (с учетом применения методики снижения ст-ти (-10%)) | R6: Плановая стоимость объекта в прогнозных ценах года окончания строительства | S6: Плановая стоимость объекта с учётом снижения инвестиционных затрат (методика -30%) | T6: Полная стоимость к распределению (минимальная между гр.9 и гр.11/ гр.14 и гр.16) | U6: Полная стоимость строительства | V6: Полная стоимость строительства (с учетом применения методики снижения ст-ти (-10%)) | W6: Плановая стоимость объекта в прогнозных ценах года окончания строительства | X6: Плановая стоимость объекта с учётом снижения инвестиционных затрат (методика -30%) | Y6: Утвержденная сметная стоимость строительства объектов | Z6: Полная стоимость строительства | AA6: Полная стоимость строительства (с учетом применения методики снижения ст-ти (-10%)) | AB6: Плановая стоимость объекта в прогнозных ценах года окончания строительства | AC6: Плановая стоимость объекта с учётом снижения инвестиционных затрат (методика -30%) | AD6: Полная стоимость к распределению (минимальная между гр.9 и гр.11/ гр.14 и гр.16) | AH6: headmarker
D7: 1 | E7: 2 | F7: 3 | G7: 4 | H7: 5 | I7: 6 | J7: 7 | K7: =RC[-1]+1 -> 8 | L7: =RC[-1]+1 -> 9 | M7: =RC[-1]+1 -> 10 | N7: =RC[-1]+1 -> 11 | O7: =RC[-1]+1 -> 12 | P7: =RC[-1]+1 -> 13 | Q7: =RC[-1]+1 -> 14 | R7: =RC[-1]+1 -> 15 | S7: =RC[-1]+1 -> 16 | T7: =RC[-1]+1 -> 17 | U7: =RC[-1]+1 -> 18 | V7: =RC[-1]+1 -> 19 | W7: =RC[-1]+1 -> 20 | X7: =RC[-1]+1 -> 21 | Y7: =RC[-1]+1 -> 22 | Z7: =RC[-1]+1 -> 23 | AA7: =RC[-1]+1 -> 24 | AB7: =RC[-1]+1 -> 25 | AC7: =RC[-1]+1 -> 26 | AD7: =RC[-1]+1 -> 27 | AE7: =RC[-1]+1 -> 28 | AF7: =RC[-1]+1 -> 29 | AG7: =RC[-1]+1 -> 30
A9: 1 | B9: = IF(RC[-1]=1, R[-2]C+1,R[-2]C) -> 1 | C9: =RC[-1] -> 1 | D9: [:a.titul.podr_name_kr] | E9: [:a.titul.tit_num_new] | F9: [:a.titul.tit_name] | G9: [:a.titul.beg_year] | H9: [:a.titul.end_year] | I9: [:a.titul.mva] | J9: [:a.titul.km] | K9: [:a.titul.summ_usr] | L9: [:a.titul.summ_10_usr] | M9: =RC[-2] -> [:a.titul.summ_usr] | N9: [:a.titul.summ_30_usr] | O9: [:a.titul.summ_utvpsd] | P9: [:a.titul.summ_psd] | Q9: [:a.titul.summ_psd_10] | R9: =RC[-2] -> [:a.titul.summ_psd] | S9: [:a.titul.summ_psd_30] | T9: [:a.titul.summ_k_rasp] | U9: [:a.titul.summ_usr_tek] | V9: [:a.titul.summ_10_usr_tek] | W9: =RC[-2] -> [:a.titul.summ_usr_tek] | X9: [:a.titul.summ_30_usr_tek] | Y9: [:a.titul.summ_utvpsd_tek] | Z9: [:a.titul.summ_psd_tek] | AA9: [:a.titul.summ_psd_10_tek] | AB9: =RC[-2] -> [:a.titul.summ_psd_tek] | AC9: [:a.titul.summ_psd_30_tek] | AD9: [:a.titul.summ_k_rasp_tek] | AE9: [:a.titul.dog_plan_cost] | AF9: =RC[-2]-RC[-1] -> #VALUE! | AG9: [:a.titul.info] | AH9: begin:a.titul | AI9: a.titul.begin:a.titul_s end:a.titul_s;
A10: 1 | B10: = IF(RC[-1]=1, R[-1]C+1,R[-1]C) -> 2 | C10: =RC[-1] -> 2 | D10: [:a.titul.podr_name_kr] | E10: [:a.titul.tit_num_new] | F10: [:a.titul.tit_name] | G10: [:a.titul.beg_year] | H10: [:a.titul.end_year] | I10: [:a.titul.mva] | J10: [:a.titul.km] | K10: [:a.titul.summ_usr] | L10: [:a.titul.summ_10_usr] | M10: =RC[-2] -> [:a.titul.summ_usr] | N10: [:a.titul.summ_30_usr] | O10: [:a.titul.summ_utvpsd] | P10: [:a.titul.summ_psd] | Q10: [:a.titul.summ_psd_10] | R10: =RC[-2] -> [:a.titul.summ_psd] | S10: [:a.titul.summ_psd_30] | T10: [:a.titul.summ_k_rasp] | U10: [:a.titul.summ_usr_tek] | V10: [:a.titul.summ_10_usr_tek] | W10: =RC[-2] -> [:a.titul.summ_usr_tek] | X10: [:a.titul.summ_30_usr_tek] | Y10: [:a.titul.summ_utvpsd_tek] | Z10: [:a.titul.summ_psd_tek] | AA10: [:a.titul.summ_psd_10_tek] | AB10: =RC[-2] -> [:a.titul.summ_psd_tek] | AC10: [:a.titul.summ_psd_30_tek] | AD10: [:a.titul.summ_k_rasp_tek] | AE10: [:a.titul.dog_plan_cost] | AF10: =RC[-2]-RC[-1] -> #VALUE! | AG10: [:a.titul.info] | AI10: a.titul.begin:a.titul_h end:a.titul_h;
B11: = IF(RC[-1]=1, R[-2]C+1,R[-2]C) -> 1 | F11: [:a.smet.name_smet_ext] | K11: [:a.smet.summ_usr] | L11: [:a.smet.summ_10_usr] | M11: =RC[-2] -> [:a.smet.summ_usr] | N11: [:a.smet.summ_30_usr] | O11: [:a.smet.summ_utvpsd] | P11: [:a.smet.summ_psd] | Q11: [:a.smet.summ_psd_10] | R11: =RC[-2] -> [:a.smet.summ_psd] | S11: [:a.smet.summ_psd_30] | T11: [:a.smet.summ_k_rasp] | U11: [:a.smet.summ_usr_tek] | V11: [:a.smet.summ_10_usr_tek] | W11: =RC[-2] -> [:a.smet.summ_usr_tek] | X11: [:a.smet.summ_30_usr_tek] | Y11: [:a.smet.summ_utvpsd_tek] | Z11: [:a.smet.summ_psd_tek] | AA11: [:a.smet.summ_psd_10_tek] | AB11: =RC[-2] -> [:a.smet.summ_psd_tek] | AC11: [:a.smet.summ_psd_30_tek] | AD11: [:a.smet.summ_k_rasp_tek] | AE11: [:a.smet.dog_plan_cost] | AF11: =RC[-2]-RC[-1] -> #VALUE! | AI11: a.titul.begin:a.smet end:a.smet;
B12: = IF(RC[-1]=1, R[-1]C+1,R[-1]C) -> 1 | F12: [:a.smet2.name_smet] | K12: [:a.smet2.summ_usr] | L12: [:a.smet2.summ_10_usr] | M12: =RC[-2] -> [:a.smet2.summ_usr] | N12: [:a.smet2.summ_30_usr] | O12: [:a.smet2.summ_utvpsd] | P12: [:a.smet2.summ_psd] | Q12: [:a.smet2.summ_psd_10] | R12: =RC[-2] -> [:a.smet2.summ_psd] | S12: [:a.smet2.summ_psd_30] | T12: [:a.smet2.summ_k_rasp] | U12: [:a.smet2.summ_usr_tek] | V12: [:a.smet2.summ_10_usr_tek] | W12: =RC[-2] -> [:a.smet2.summ_usr_tek] | X12: [:a.smet2.summ_30_usr_tek] | Y12: [:a.smet2.summ_utvpsd_tek] | Z12: [:a.smet2.summ_psd_tek] | AA12: [:a.smet2.summ_psd_10_tek] | AB12: =RC[-2] -> [:a.smet2.summ_psd_tek] | AC12: [:a.smet2.summ_psd_30_tek] | AD12: [:a.smet2.summ_k_rasp_tek] | AE12: [:a.smet2.dog_plan_cost] | AI12: a.titul.begin:a.smet2 end:a.smet2;
B13: = IF(RC[-1]=1, R[-1]C+1,R[-1]C) -> 1 | F13: [:a.smet_dop.name_smet_ext] | I13: [:a.smet_dop.mva] | J13: [:a.smet_dop.km] | L13: [:a.smet_dop.all_10_usr] | N13: [:a.smet_dop.all_30_usr] | Q13: [:a.smet_dop.all_psd_10] | S13: [:a.smet_dop.all_psd_30] | V13: [:a.smet_dop.all_10_usr_tek] | X13: [:a.smet_dop.all_30_usr_tek] | AA13: [:a.smet_dop.all_psd_10_tek] | AC13: [:a.smet_dop.all_psd_30_tek] | AI13: a.titul.begin:a.smet_dop end:a.smet_dop;
X14: № договора | Y14: Предмет договора | Z14: Дата начала действия договора | AA14: Дата окончания действия договора | AB14: Наименование контрагента | AC14: Статус договора | AD14: Тип договора | AE14: Сумма по договору | AI14: a.titul.begin:a.dogh
X15: [:a.dog.num_i] | Y15: [:a.dog.predm_dog] | Z15: [:a.dog.date_i] | AA15: [:a.dog.date_end_i] | AB15: [:a.dog.name_contr] | AC15: [:a.dog.status_i] | AD15: [:a.dog.tip_i] | AE15: [:a.dog.dog_plan_cost] | AI15: end:a.dogh; | AJ15: a.dogh.begin:a.dog end:a.dog;
A16: 1 | B16: = IF(RC[-1]=1, R[-3]C+1,R[-3]C) -> 2 | C16: =RC[-1] -> 2 | D16: [:a.titul_ch.podr_name_kr_ch] | E16: [:a.titul_ch.tit_num_new_ch] | F16: [:a.titul_ch.tit_name_ch] | G16: [:a.titul_ch.beg_year_ch] | H16: [:a.titul_ch.end_year_ch] | I16: [:a.titul_ch.mva] | J16: [:a.titul_ch.km] | K16: [:a.titul_ch.summ_usr] | L16: [:a.titul_ch.summ_10_usr] | M16: =RC[-2] -> [:a.titul_ch.summ_usr] | N16: [:a.titul_ch.summ_30_usr] | O16: [:a.titul_ch.summ_utvpsd] | P16: [:a.titul_ch.summ_psd] | Q16: [:a.titul_ch.summ_psd_10] | R16: =RC[-2] -> [:a.titul_ch.summ_psd] | S16: [:a.titul_ch.summ_psd_30] | T16: [:a.titul_ch.summ_k_rasp] | U16: [:a.titul_ch.summ_usr_tek] | V16: [:a.titul_ch.summ_10_usr_tek] | W16: =RC[-2] -> [:a.titul_ch.summ_usr_tek] | X16: [:a.titul_ch.summ_30_usr_tek] | Y16: [:a.titul_ch.summ_utvpsd_tek] | Z16: [:a.titul_ch.summ_psd_tek] | AA16: [:a.titul_ch.summ_psd_10_tek] | AB16: =RC[-2] -> [:a.titul_ch.summ_psd_tek] | AC16: [:a.titul_ch.summ_psd_30_tek] | AD16: [:a.titul_ch.summ_k_rasp_tek] | AE16: [:a.titul_ch.dog_plan_cost] | AF16: =RC[-2]-RC[-1] -> #VALUE! | AG16: [:a.titul_ch.info] | AI16: a.titul.begin:a.titul_ch
B17: = IF(RC[-1]=1, R[-1]C+1,R[-1]C) -> 2 | F17: [:a.smet_ch.name_smet_ext] | K17: [:a.smet_ch.summ_usr] | L17: [:a.smet_ch.summ_10_usr] | M17: =RC[-2] -> [:a.smet_ch.summ_usr] | N17: [:a.smet_ch.summ_30_usr] | O17: [:a.smet_ch.summ_utvpsd] | P17: [:a.smet_ch.summ_psd] | Q17: [:a.smet_ch.summ_psd_10] | R17: =RC[-2] -> [:a.smet_ch.summ_psd] | S17: [:a.smet_ch.summ_psd_30] | T17: [:a.smet_ch.summ_k_rasp] | U17: [:a.smet_ch.summ_usr_tek] | V17: [:a.smet_ch.summ_10_usr_tek] | W17: =RC[-2] -> [:a.smet_ch.summ_usr_tek] | X17: [:a.smet_ch.summ_30_usr_tek] | Y17: [:a.smet_ch.summ_utvpsd_tek] | Z17: [:a.smet_ch.summ_psd_tek] | AA17: [:a.smet_ch.summ_psd_10_tek] | AB17: =RC[-2] -> [:a.smet_ch.summ_psd_tek] | AC17: [:a.smet_ch.summ_psd_30_tek] | AD17: [:a.smet_ch.summ_k_rasp_tek] | AE17: [:a.smet_ch.dog_plan_cost] | AF17: =RC[-2]-RC[-1] -> #VALUE! | AJ17: a.titul_ch.begin:a.smet_ch end:a.smet_ch;
B18: = IF(RC[-1]=1, R[-1]C+1,R[-1]C) -> 2 | F18: [:a.smet2_ch.name_smet] | K18: [:a.smet2_ch.summ_usr] | L18: [:a.smet2_ch.summ_10_usr] | M18: =RC[-2] -> [:a.smet2_ch.summ_usr] | N18: [:a.smet2_ch.summ_30_usr] | O18: [:a.smet2_ch.summ_utvpsd] | P18: [:a.smet2_ch.summ_psd] | Q18: [:a.smet2_ch.summ_psd_10] | R18: =RC[-2] -> [:a.smet2_ch.summ_psd] | S18: [:a.smet2_ch.summ_psd_30] | T18: [:a.smet2_ch.summ_k_rasp] | U18: [:a.smet2_ch.summ_usr_tek] | V18: [:a.smet2_ch.summ_10_usr_tek] | W18: =RC[-2] -> [:a.smet2_ch.summ_usr_tek] | X18: [:a.smet2_ch.summ_30_usr_tek] | Y18: [:a.smet2_ch.summ_utvpsd_tek] | Z18: [:a.smet2_ch.summ_psd_tek] | AA18: [:a.smet2_ch.summ_psd_10_tek] | AB18: =RC[-2] -> [:a.smet2_ch.summ_psd_tek] | AC18: [:a.smet2_ch.summ_psd_30_tek] | AD18: [:a.smet2_ch.summ_k_rasp_tek] | AE18: [:a.smet2_ch.dog_plan_cost] | AJ18: a.titul_ch.begin:a.smet2_ch end:a.smet2_ch;
B19: = IF(RC[-1]=1, R[-1]C+1,R[-1]C) -> 2 | F19: [:a.smet_dop_ch.name_smet_ext] | I19: [:a.smet_dop_ch.mva] | J19: [:a.smet_dop_ch.km] | L19: [:a.smet_dop_ch.all_10_usr] | N19: [:a.smet_dop_ch.all_30_usr] | Q19: [:a.smet_dop_ch.all_psd_10] | S19: [:a.smet_dop_ch.all_psd_30] | V19: [:a.smet_dop_ch.all_10_usr_tek] | X19: [:a.smet_dop_ch.all_30_usr_tek] | AA19: [:a.smet_dop_ch.all_psd_10_tek] | AC19: [:a.smet_dop_ch.all_psd_30_tek] | AJ19: a.titul_ch.begin:a.smet_dop_ch end:a.smet_dop_ch;
X20: № договора | Y20: Предмет договора | Z20: Дата начала действия договора | AA20: Дата окончания действия договора | AB20: Наименование контрагента | AC20: Статус договора | AD20: Тип договора | AE20: Сумма по договору | AJ20: a.titul_ch.begin:a.dogh_ch
X21: [:a.dog_ch.num_i] | Y21: [:a.dog_ch.predm_dog] | Z21: [:a.dog_ch.date_i] | AA21: [:a.dog_ch.date_end_i] | AB21: [:a.dog_ch.name_contr] | AC21: [:a.dog_ch.status_i] | AD21: [:a.dog_ch.tip_i] | AE21: [:a.dog_ch.dog_plan_cost] | AH21: end:a.titul; | AI21: end:a.titul_ch; | AJ21: end:a.dogh_ch; | AK21: a.dogh_ch.begin:a.dog_ch end:a.dog_ch;