Sheet: прил 13
J1: Приложение 13
D3: Начисление потребителей с разбивкой по НДС за период с 01 [:t.mess] [:t.years] по [:t.daypo] [:t.mespo] [:t.yearpo] | M3: begin:t
E4: [:t.name_dep] | M4: end:t;
B5: № п.п. | C5: Номер договора | D5: № акта | E5: Начислено кВт.ч | F5: Начислено руб | H5: ИТОГО с НДС | I5: Оплачено кВт.ч. | J5: Оплачено руб. | L5: ИТОГО с НДС
A7: 0 | F7: с НДС | G7: без НДС | J7: с НДС | K7: без НДС
A8: =R[-1]C -> 0 | B8: Акты, составленные [:a.a1.akt_bu_org_name]: | N8: begin:a.a1
A9: =R[-1]C -> 0 | O9: a.a1.begin:a.b
A10: =R[-2]C -> 0 | B10: [:a.b.obj_tar_name]:
A11: =RC[1] -> 1 | B11: =R[-1]C[-1]+1 -> 1 | C11: [:a.c.ndog] | D11: [:a.c.akt_num] | E11: [:a.c.acc_cust_pl_dbu_e4] | F11: [:a.c.acc_nach_pl_dbu] | G11: [:a.c.acc_nach_bn_pl_dbu] | H11: [:a.c.acc_nach_pl_dbu] | I11: [:a.c.opl_nach_cust] | J11: [:a.c.opl_nach] | K11: [:a.c.opl_nach_bn] | L11: [:a.c.opl_nach] | P11: a.b.begin:a.c end:a.c;
A12: =R[-1]C -> 1
A13: =R[-1]C -> 1 | B13: Итого [:a.b.obj_tar_name]: | E13: [:a.b.acc_cust_pl_dbu_e4] | F13: [:a.b.acc_nach_pl_dbu] | G13: [:a.b.acc_nach_bn_pl_dbu] | H13: [:a.b.acc_nach_pl_dbu] | I13: [:a.b.opl_nach_cust] | J13: [:a.b.opl_nach] | K13: [:a.b.opl_nach_bn] | L13: [:a.b.opl_nach] | O13: end:a.b;
A14: =R[-1]C -> 1
A15: =R[-1]C -> 1 | B15: Итого [:a.a1.akt_bu_org_name] : | E15: [:a.a1.acc_cust_pl_dbu_e4] | F15: [:a.a1.acc_nach_pl_dbu] | G15: [:a.a1.acc_nach_bn_pl_dbu] | H15: [:a.a1.acc_nach_pl_dbu] | I15: [:a.a1.opl_nach_cust] | J15: [:a.a1.opl_nach] | K15: [:a.a1.opl_nach_bn] | L15: [:a.a1.opl_nach] | N15: end:a.a1;
A16: =R[-1]C -> 1
B17: ВСЕГО: | E17: [:a.ai.acc_cust_pl_dbu_e4] | F17: [:a.ai.acc_nach_pl_dbu] | G17: [:a.ai.acc_nach_bn_pl_dbu] | H17: [:a.ai.acc_nach_pl_dbu] | I17: [:a.ai.opl_nach_cust] | J17: [:a.ai.opl_nach] | K17: [:a.ai.opl_nach_bn] | L17: [:a.ai.opl_nach] | N17: begin:a.ai end:a.ai;