Sheet: Лист1
A1: Версия: 19.01.2025 | F1: Отчет о состоянии дебиторской задолженности по стостоянию на [:t.dat] [:t.deps_name] | AZ1: begin:t
S2: Проверка | AE2: cbegin:mes1 | AM2: cbegin:god1 | AP2: cbegin:ur
A3: № Дог. | B3: Наименование | C3: ИНН | D3: Условия оплаты по договору (аванс) | E3: Условия оплаты по договору (постоплата) | F3: Группа потребителей | G3: Подгруппа потребителей | H3: Отделение | I3: Начислено за [:t.pred_mes] | K3: Задолженность на [:t.date_begin] | N3: Признак принадлеж. к особо круп. предприятиям | O3: Промежуточный платеж | P3: % промежуточного платежа согласно условиям договора | Q3: Оплата энергии за [:t.mes] | R3: Дебиторская задолженность на [:t.dat] | S3: Нормативная задолженность | X3: Сверхнормативная задолженность | Z3: Сравнение | AC3: Нормативная дебиторская задолженность | AD3: Сверхнормативная задолженность | AE3: в т.ч. сверхнормативная по месяцам | AH3: в т.ч. сверхнормативная по группам месяцев | AM3: в т.ч. сверхнормативная по годам | AP3: в т.ч. сверхнормативная по юридическому статусу | AR3: Задолженность по госпошлине на [:t.dat] | AS3: Задолженность по процентам по судебному решению на [:t.dat] | AT3: Задолженность по процентам за неисполнение решения суда (8,25%) на [:t.dat] | AU3: Задолженность на [:t.dat] включенная в графики погашения задолженности | AW3: Количество периодов задолженности на [:t.dat] | AX3: Количество периодов неотработанной задолженности
I4: Всего | J4: В т. ч. отрицательные перерасчеты | K4: Общая | L4: Кредиторская | M4: Дебиторская | S4: Начисления без отрицательных перерасчетов | T4: Промежуточный платеж (факт) | U4: Начислено минус аванс | V4: Ограничение по ДЗ | W4: Исключение отрицательных | X4: ДЗ-Нормативная | Y4: Исключение отрицательных | Z4: Нормативная | AA4: Сверхнормативная | AB4: Нормативная и Сверхнормативная | AE4: [mes1.title] | AF4: и ранее | AH4: от 1-3 месяцев | AI4: от 3-6 месяцев | AJ4: от 6-до 1 года | AK4: более 1 года | AM4: [god1.title] | AN4: Свыше 5 лет | AP4: в т.ч. [ur.title] | AQ4: прочая | AV4: Выполненные мероприятия
A5: 1 | B5: 2 | C5: 3 | D5: 4 | E5: 5 | F5: 6 | G5: 7 | H5: 8 | I5: 9 | K5: 10 | L5: 11 | M5: 12 | N5: 13 | O5: 14 | P5: 15 | Q5: 16 | R5: 17 | AC5: 18 | AD5: 19 | AE5: =RC[-1]+1 -> 20 | AF5: =RC[-1]+1 -> 21 | AG5: =RC[-1]+1 -> 22 | AH5: =RC[-1] -> 22 | AI5: =RC[-1]+1 -> 23 | AJ5: =RC[-1]+1 -> 24 | AK5: =RC[-1]+1 -> 25 | AL5: =RC[-1] -> 25 | AM5: =RC[-1]+1 -> 26 | AN5: =RC[-1]+1 -> 27 | AO5: =RC[-1]+1 -> 28 | AP5: =RC[-1] -> 28 | AQ5: =RC[-1]+1 -> 29 | AR5: =RC[-1]+1 -> 30 | AS5: =RC[-1]+1 -> 31 | AT5: =RC[-1]+1 -> 32 | AU5: =RC[-1]+1 -> 33 | AV5: =RC[-1]+1 -> 34 | AW5: =RC[-1]+1 -> 35 | AX5: =RC[-1]+1 -> 36 | AZ5: end:t;
A6: [:a.ndog] | B6: [:a.kodp_name] | C6: [:a.kodp_inn] | D6: [:a.avans_info] | E6: [:a.postplat_info] | F6: [:a.user_group_parent] | G6: [:a.user_group] | H6: [:a.dep_name] | I6: [:a.nachisl_osn] | J6: [:a.nachisl_osn_neg] | K6: [:a.dolg_obsh_per] | L6: [:a.dolg_kred_per] | M6: [:a.dolg_deb_per] | N6: [:a.krup] | O6: [:a.nachisl_av] | P6: [:a.avans_proc] | Q6: [:a.opl] | R6: [:a.dolg_deb_dat] | S6: =RC[-10]-RC[-9] -> #VALUE! | T6: [:a.last_av_fact_v2] | U6: =RC[-2]-RC[-6]-RC[-1] -> #VALUE! | V6: =IF(RC[-1]>RC[-9],RC[-9],RC[-1]) -> #VALUE! | W6: =IF(RC[-1]<0,0,RC[-1]) -> #VALUE! | X6: =RC[-11]-RC[-1] -> #VALUE! | Y6: =IF(RC[-1]<0,0,RC[-1]) -> #VALUE! | Z6: =ABS( RC[-3]-RC[3])<0.009 -> #VALUE! | AA6: =ABS( RC[-2]-RC[3])<0.009 -> #VALUE! | AB6: =AND(RC[-1],RC[-2]) -> #VALUE! | AC6: [:a.norm_dolg] | AD6: [:a.sverh_dolg] | AE6: [:a.sv_dlg_mes[mes1.pfx]] | AF6: [:a.sv_dlg_mes_othr] | AH6: [:a.sv_dlg_per1_3] | AI6: [:a.sv_dlg_per4_6] | AJ6: [:a.sv_dlg_per7_12] | AK6: [:a.sv_dlg_per13_] | AM6: [:a.sv_dlg_god[god1.pfx]] | AN6: [:a.sv_dlg_god_othr] | AP6: [:a.sv_dlg_ur[ur.pfx]] | AQ6: [:a.sv_dlg_ur_proch] | AR6: [:a.dolg_gp_dat] | AS6: [:a.dolg_peni_dat] | AT6: [:a.dolg_astr_dat] | AU6: [:a.dolg_graf_dat] | AV6: [:a.ur_info] | AW6: [:a.dolg_deb_dat_cnt] | AX6: [:a.sv_dlg_ur_proch_cnt] | AZ6: begin:a end:a;
A7: Итого
I8: =SUM(R6C:R[-1]C) -> 0 | J8: =SUM(R6C:R[-1]C) -> 0 | K8: =SUM(R6C:R[-1]C) -> 0 | L8: =SUM(R6C:R[-1]C) -> 0 | M8: =SUM(R6C:R[-1]C) -> 0 | O8: =SUM(R6C:R[-1]C) -> 0 | Q8: =SUM(R6C:R[-1]C) -> 0 | R8: =SUM(R6C:R[-1]C) -> 0 | AC8: =SUM(R6C:R[-1]C) -> 0 | AD8: =SUM(R6C:R[-1]C) -> 0 | AE8: =SUM(R6C:R[-1]C) -> 0 | AF8: =SUM(R6C:R[-1]C) -> 0 | AG8: =SUM(R6C:R[-1]C) -> 0 | AH8: =SUM(R6C:R[-1]C) -> 0 | AI8: =SUM(R6C:R[-1]C) -> 0 | AJ8: =SUM(R6C:R[-1]C) -> 0 | AK8: =SUM(R6C:R[-1]C) -> 0 | AL8: =SUM(R6C:R[-1]C) -> 0 | AM8: =SUM(R6C:R[-1]C) -> 0 | AN8: =SUM(R6C:R[-1]C) -> 0 | AO8: =SUM(R6C:R[-1]C) -> 0 | AP8: =SUM(R6C:R[-1]C) -> 0 | AQ8: =SUM(R6C:R[-1]C) -> 0 | AR8: =SUM(R6C:R[-1]C) -> 0 | AS8: =SUM(R6C:R[-1]C) -> 0 | AT8: =SUM(R6C:R[-1]C) -> 0 | AU8: =SUM(R6C:R[-1]C) -> 0 | AW8: =SUM(R6C:R[-1]C) -> 0 | AX8: =SUM(R6C:R[-1]C) -> 0
AE9: cend:mes1; | AM9: cend:god1; | AP9: cend:ur;