Sheet: Лист1
D2: Оборотная ведомость по видам товара [:t.deps_name] за [:t.smes] [:t.year] г. | O2: begin:t
D4: № п/п | E4: Наименование товара | F4: Сальдо (начальное) на [:t.sdat_beg] г | H4: Начисление | J4: Оплата | L4: Сальдо (конечное) на [:t.sdat_end] г. | O4: end:t; | P4: !rowheight:48
B5: 0 | F5: Количество | G5: Сумма | H5: Количество | I5: Сумма | J5: Количество | K5: Сумма | L5: Количество | M5: Сумма
A6: =R[-1]C[1] -> 0 | B6: =RC[-1]+1 -> 1 | C6: 0 | D6: =RC[-2] -> 1 | E6: [:a.tgr.name_t_gr] | O6: begin:a.tgr
A7: =R[-1]C[1] -> 1 | B7: =RC[-1] -> 1 | C7: =R[-1]C+1 -> 1 | D7: =CONCATENATE(RC[-2],".",RC[-1]) -> 1.1 | E7: [:a.gr.name_t_teplo] | F7: [:a.gr.odorot_beg_cust] | G7: [:a.gr.odorot_beg_mon] | H7: [:a.gr.sr_facras_cust] | I7: [:a.gr.sr_facras_nachisl] | J7: [:a.gr.sr_facopl_cust] | K7: [:a.gr.sr_facopl_opl] | L7: [:a.gr.odorot_end_cust] | M7: [:a.gr.odorot_end_mon] | O7: end:a.tgr; | P7: a.tgr.begin:a.gr end:a.gr;
A8: =R[-1]C[1] -> 1 | B8: =RC[-1]+1 -> 2 | D8: =RC[-2] -> 2 | E8: Авансы | G8: [:av.fin_ul_ob_kr_beg] | I8: 0 | K8: [:av.fin_ul_ob_kr] | M8: [:av.fin_ul_ob_kr_end] | O8: begin:av end:av;
A9: =R[-1]C[1] -> 2 | B9: =RC[-1]+1 -> 3 | D9: =RC[-2] -> 3 | E9: Переплата | G9: [:per.fin_ul_ob_kr_beg] | I9: 0 | K9: [:per.fin_ul_ob_kr] | M9: [:per.fin_ul_ob_kr_end] | O9: begin:per end:per;
E10: Итого | F10: =SUM(R6C:R[-1]C) -> 0 | G10: =SUM(R6C:R[-1]C) -> 0 | H10: =SUM(R6C:R[-1]C) -> 0 | I10: =SUM(R6C:R[-1]C) -> 0 | J10: =SUM(R6C:R[-1]C) -> 0 | K10: =SUM(R6C:R[-1]C) -> 0 | L10: =SUM(R6C:R[-1]C) -> 0 | M10: =SUM(R6C:R[-1]C) -> 0
D12: Начальник ОРПТЭ | G12: ___________________________
D14: Исполнитель | G14: ___________________________