Sheet: Лист1
C1: [:t.deps_name] | M1: begin:t
C2: Оплата по судебным решениям с [:t.name] за [:t.mes] [:t.year]г
M3: end:t;
A4: 0 | B4: № | C4: Наименование абонента | D4: Группа потребителей | E4: Подгруппа потребителей | F4: ДАТА | G4: № док | H4: ВИД реализации | I4: Назначение платежа | J4: сумма | K4: номер дела | L4: источник оплаты
A5: =R[-1]C+1 -> 1 | B5: =RC[-1] -> 1 | C5: [:a.a1.name_p] | D5: [:a.a1.name_group_cust_parent] | E5: [:a.a1.name_group_cust] | F5: [:a.a1.dat_opl] | G5: [:a.a1.num_opl] | H5: госпошлина | I5: [:a.a1.remark] | J5: [:a.a1.opl] | K5: [:a.a1.num_delo] | L5: [:a.a1.name_bpol] | M5: begin:a.ai1 | N5: a.ai1.begin:a.a1 end:a.a1;
A6: 0 | B6: Итого госпошлина: | J6: [:a.ai1.opl] | M6: end:a.ai1;
A7: =R[-1]C+1 -> 1 | B7: =RC[-1] -> 1 | C7: [:a.a2.name_p] | D7: [:a.a2.name_group_cust_parent] | E7: [:a.a2.name_group_cust] | F7: [:a.a2.dat_opl] | G7: [:a.a2.num_opl] | H7: проценты | I7: [:a.a2.remark] | J7: [:a.a2.opl] | K7: [:a.a2.num_delo] | L7: [:a.a2.name_bpol] | M7: begin:a.ai2 | N7: a.ai2.begin:a.a2 end:a.a2;
A8: 0 | B8: Итого оплата процентов по решению суда: | J8: [:a.ai2.opl] | M8: end:a.ai2;
A9: =R[-1]C+1 -> 1 | B9: =RC[-1] -> 1 | C9: [:a.a3.name_p] | D9: [:a.a3.name_group_cust_parent] | E9: [:a.a3.name_group_cust] | F9: [:a.a3.dat_opl] | G9: [:a.a3.num_opl] | H9: проценты за несвоевременное исполнение | I9: [:a.a3.remark] | J9: [:a.a3.opl] | K9: [:a.a3.num_delo] | L9: [:a.a3.name_bpol] | M9: begin:a.ai3 | N9: a.ai3.begin:a.a3 end:a.a3;
B10: Итого оплата процентов за несвоевременное исполнение решения суда: | J10: [:a.ai3.opl] | M10: end:a.ai3;