Sheet: Лист1
B1: Свод по распределению договоров ТП по филиалам ПАО "Ленэнерго" с указанием актуализации статусов договоров на [:h.cur_date] | P1: begin:h | AC1: Приложение № 3 к Приказу от 25.12.15 №609
D2: cbegin:mo | P2: h.begin:a.podr
A3: 0 | B3: [:a.podr.kod_direct_name] | C3: ИТОГО | D3: [mo.title] | O3: !rowheight:108
A4: =R[-1]C+1 -> 1 | B4: ИТОГО | C4: [:a.podr.is_dop_cont_count] | D4: [:a.podr.is_dop_cont_count_by_mo[mo.pfx]]
A5: =R[-1]C+1 -> 2 | B5: [:a.year.req_year_fl] | C5: [:a.year.is_dop_cont_count] | D5: [:a.year.is_dop_cont_count_by_mo[mo.pfx]] | P5: a.podr.begin:a.year end:a.year;
A6: =R[-1]C+1 -> 3 | B6: В том числе на [:h.cur_date]:
A7: =R[-1]C+1 -> 4 | B7: [:a.status.status_name] | C7: [:a.status.is_dop_cont_count] | D7: [:a.status.is_dop_cont_count_by_mo[mo.pfx]] | P7: a.podr.begin:a.status end:a.status;
A8: =ROW(RC)-R[-1]C -> 4 | D8: =IF(INDEX(C,RC1,1)>0,"",CONCATENATE("!delete:",RC1-1,",",COLUMN(RC),",",ROW(RC),",",COLUMN(RC))) ->  | O8: !rowheight:0
D9: cend:mo; | P9: end:a.podr;
B10: Примечание: данное распределение заявок между филиалами ПАО "Ленэнерго" является ориентировочным исходя из имеющейся информации на дату утверждения приказа (разночтения могут возникнуть по сумме столбцов "уточняется"). | P10: end:h;