Sheet: Лист1
H2: =IF(T(R[7]C[-6])="", CONCATENATE("Сведения по авансовым расчетам ", R[7]C[-5]," за ",R[7]C[-7]," ",R[7]C[-6],),"Сведения по авансовым расчетам") -> Сведения по авансовым расчетам
I3: cbegin:year | L3: cbegin:year | N3: cbegin:year | O3: cbegin:year | P3: cbegin:year | Q3: cbegin:year | R3: cbegin:year | S3: cbegin:year | T3: cbegin:year | U3: cbegin:year | V3: cbegin:year | W3: cbegin:year | X3: cbegin:year | Y3: cbegin:year | Z3: cbegin:year | AF3: cbegin:year
N4: [year.title] | P4: [year.title]
I5: 1 | J5: 1 | K5: 0 | L5: 1 | M5: 1 | N5: 1 | O5: 1 | P5: 1 | AA5: 1 | AB5: 1 | AC5: 1 | AD5: 1 | AE5: 1 | AF5: 1 | AG5: 1
E6: № п/п | F6: № договора | G6: Наименование абонента | H6: Кредитовая задолженность на начало месяца | K6: Сумма авансовых платежей , участвующих в погашении начисления за текущий месяц | N6: Списание [merge] | O6: Возврат [merge] | P6: Переброски [merge] | Q6: Сторно оплаты со сч. 62.02.1-переброска оплаты на сч.76.02.2 (76/101)(заявление/письмо потребителя) [merge] | R6: Сторно оплаты со сч. 62.02.1 -переброска оплаты на сч.91.01 (91/92)(заявление/письмо потребителя) [merge] | S6: Сторно оплаты со сч. 62.02.1 -погашение забалансовой задолженности (007) 91.01(заявление/письмо потребителя) [merge] | T6: Сторно оплаты со сч. 62.02.1 -переброска оплаты на сч.76.06.1 (76/007)(заявление/письмо потребителя) [merge] | U6: Сторно оплаты со сч. 62.02.1 -переброска оплаты на сч.76.50 (заявление/письмо потребителя) [merge] | V6: Сторно оплаты со сч. 62.02.1 -переброска оплаты на сч.62.01.5 (62/6)(заявление/письмо потребителя) [merge] | W6: Сторно оплаты со сч. 62.02.1 -переброска оплаты на сч.76/2 (76.42.1) [merge] | X6: Сторно оплаты со сч. 62.02.1 -переброска оплаты на сч. 76/010 (76.09.1) [merge] | Y6: Сторно оплаты со сч. 62.02.1 -переброска оплаты на сч. 76.02.3) [merge] | Z6: Сторно оплаты со сч. 62.02.1 -переброска оплаты на сч. 62.01.9 [merge] | AA6: Поступление авансовых платежей в отчетном месяце | AE6: Кредитовая задолженность на конец месяца | AI6: headmarker
H7: Всего | I7: В т.ч. кредитовая задолженность [year.title] г. на начало месяца | K7: Всего | L7: В т.ч.сумма авансовых платежей [year.title] года, участвующих в погашении начисления за текущий месяц | M7: В т.ч. сумма авансовых платежей текущего месяца, участвующих в погашении начисления за текущий месяц | N7: =CONCATENATE("в т.ч. ", R[-3]C," года (НДС ",IF(N(VALUE(R[-3]C))<2019, "18","20"),"%)") -> #VALUE! | O7: в т.ч. авансов [year.title] года | P7: =CONCATENATE("в т.ч. ", R[-3]C," года (НДС ",IF(N(VALUE(R[-3]C))<2019, "18","20"),"%)") -> #VALUE! | Q7: в т.ч. [year.title] год | R7: в т.ч. [year.title] год | S7: в т.ч. [year.title] год | T7: в т.ч. [year.title] год | U7: в т.ч. [year.title] год | V7: в т.ч. [year.title] год | W7: в т.ч. [year.title] год | X7: в т.ч. [year.title] год | Y7: в т.ч. [year.title] год | Z7: в т.ч. [year.title] год | AA7: Сумма авансовых платежей (оплата) за месяц - ВСЕГО | AB7: в т.ч. по агентскому договору с Татэнергосбытом (Энергосбыт) сч. 76 | AC7: в т.ч. сумма денежных авансовых платежей (оплата) за текущий месяц Татэнергосбыта | AD7: в т.ч. сумма поступления авансовых платежей зерном (договор уступки права требования) сч. 76 | AE7: Всего | AF7: В т.ч. кредитовая задолженность [year.title]г. на конец месяца | AI7: headmarker
D8: 0 | E8: 1 | F8: 2 | G8: 3 | H8: 4 | I8: =RC[-1]+R[-3]C -> 5 | J8: =RC[-1]+R[-3]C -> 6 | K8: =RC[-1]+R[-3]C -> 6 | L8: =RC[-1]+R[-3]C -> 7 | M8: =RC[-1]+R[-3]C -> 8 | N8: =RC[-1]+R[-3]C -> 9 | O8: =RC[-1]+R[-3]C -> 10 | P8: =RC[-1]+R[-3]C -> 11 | Q8: 12 | R8: 13 | S8: 14 | T8: 15 | U8: 16 | V8: 17 | W8: 18 | X8: 19 | Y8: 20 | Z8: 21 | AA8: 14 | AB8: 15 | AC8: 16 | AD8: 17 | AE8: =RC[-1]+R[-3]C -> 18 | AF8: =RC[-1]+R[-3]C -> 19 | AG8: =RC[-1]+R[-3]C -> 20
A9: [:a.month] | B9: [:a.year] | C9: [:a.dep_name] | D9: =R[-1]C+1 -> 1 | E9: =RC[-1] -> 1 | F9: [:a.ndog] | G9: [:a.name] | H9: [:a.kredit_beg] | I9: [:a.kredit_beg_by_year[year.pfx]] | K9: [:a.opl_nach_avans_per] | L9: [:a.opl_nach_avans_last[year.pfx]] | M9: [:a.opl_nach_avans_tek] | N9: [:a.opl_spisanie_avans[year.pfx]] | O9: [:a.opl_vozvrat_avans[year.pfx]] | P9: [:a.opl_perenos_avans[year.pfx]] | Q9: [:a.opl_perenos_99[year.pfx]] | R9: [:a.opl_perenos_100[year.pfx]] | S9: [:a.opl_perenos_101[year.pfx]] | T9: [:a.opl_perenos_102[year.pfx]] | U9: [:a.opl_perenos_89[year.pfx]] | V9: [:a.opl_perenos_103[year.pfx]] | W9: [:a.opl_perenos_104[year.pfx]] | X9: [:a.opl_perenos_105[year.pfx]] | Y9: [:a.opl_perenos_106[year.pfx]] | Z9: [:a.opl_perenos_107[year.pfx]] | AA9: [:a.opl_avans_all] | AC9: [:a.opl_avans_all] | AE9: [:a.kredit_end] | AF9: [:a.kredit_end_by_year[year.pfx]] | AI9: begin:a end:a;
G11: Итого: | H11: =SUM(R9C:R[-1]C) -> 0 | I11: =SUM(R9C:R[-1]C) -> 0 | K11: =SUM(R9C:R[-1]C) -> 0 | L11: =SUM(R9C:R[-1]C) -> 0 | M11: =SUM(R9C:R[-1]C) -> 0 | N11: =SUM(R9C:R[-1]C) -> 0 | O11: =SUM(R9C:R[-1]C) -> 0 | P11: =SUM(R9C:R[-1]C) -> 0 | Q11: =SUM(R9C:R[-1]C) -> 0 | R11: =SUM(R9C:R[-1]C) -> 0 | S11: =SUM(R9C:R[-1]C) -> 0 | T11: =SUM(R9C:R[-1]C) -> 0 | U11: =SUM(R9C:R[-1]C) -> 0 | V11: =SUM(R9C:R[-1]C) -> 0 | W11: =SUM(R9C:R[-1]C) -> 0 | X11: =SUM(R9C:R[-1]C) -> 0 | Y11: =SUM(R9C:R[-1]C) -> 0 | Z11: =SUM(R9C:R[-1]C) -> 0 | AA11: =SUM(R9C:R[-1]C) -> 0 | AB11: =SUM(R9C:R[-1]C) -> 0 | AC11: =SUM(R9C:R[-1]C) -> 0 | AE11: =SUM(R9C:R[-1]C) -> 0 | AF11: =SUM(R9C:R[-1]C) -> 0
I12: cend:year; | L12: cend:year; | N12: cend:year; | O12: cend:year; | P12: cend:year; | Q12: cend:year; | R12: cend:year; | S12: cend:year; | T12: cend:year; | U12: cend:year; | V12: cend:year; | W12: cend:year; | X12: cend:year; | Y12: cend:year; | Z12: cend:year; | AF12: cend:year;